[
  {
    "contract": "kernel_watchdog_result",
    "version": "v1",
    "watchdog_id": "kw:kx:review-rerun-case_hyp_gc_45:observed_state",
    "exchange_id": "kx:review-rerun-case_hyp_gc_45:observed_state",
    "kernel_name": "observed_state",
    "verdict": "pass",
    "reasons": [],
    "timestamp": "2026-03-16T12:30:00Z"
  },
  {
    "contract": "kernel_watchdog_result",
    "version": "v1",
    "watchdog_id": "kw:kx:review-rerun-case_hyp_gc_45:expected_state",
    "exchange_id": "kx:review-rerun-case_hyp_gc_45:expected_state",
    "kernel_name": "expected_state",
    "verdict": "pass",
    "reasons": [],
    "timestamp": "2026-03-16T12:30:00Z"
  },
  {
    "contract": "kernel_watchdog_result",
    "version": "v1",
    "watchdog_id": "kw:kx:review-rerun-case_hyp_gc_45:contradiction",
    "exchange_id": "kx:review-rerun-case_hyp_gc_45:contradiction",
    "kernel_name": "contradiction",
    "verdict": "pass",
    "reasons": [],
    "timestamp": "2026-03-16T12:30:00Z"
  }
]